{
  "disclaimer": "A negotiation aid, not financial, legal, or tax advice. Multipliers and scripts reflect reported 2026 third-party benchmarks and ranges, never quotes, promises, or platform rules.",
  "negotiation_scripts": [
    {
      "body": "Hi {{brand}} team, thanks for the offer. Based on my last-10-video average of {{views_avg}} views, my {{deliverable}} slots benchmark at ${{range_lo}}–${{range_hi}} on the 2026 creator rate card for my tier. My counter is ${{counter}} for the post fee alone. I can flex on scope or timeline, but the rate is the rate, it's what the numbers support.",
      "grounded_in": "Rate card: quote at the top of the range, creators list rates ~23% above what they accept.",
      "id": "lowball_counter",
      "tip": "Quote high and expect to be negotiated down ~23%. The counter names the benchmark, not your feelings.",
      "title": "Lowball counter",
      "when": "The offer came in under your tier range."
    },
    {
      "body": "Quick flag on the usage terms, {{brand}}: the post fee covers organic placement only. Paid-ad usage is priced separately, per the 2026 benchmarks: {{usage_tier_label}}. That's a ${{usage_addon}} line item on top of the ${{post_fee}} post fee, with a hard end date in the contract. Running my content as your ads for a year captures thousands in value for you, it has to be its own line.",
      "grounded_in": "Rate card: paid-ad usage is +50–100% as a separate line item, the single most-neglected line item in creator deals.",
      "id": "usage_rights_upsell",
      "tip": "Never let paid-ad usage hide inside the post fee. Name the tier, name the multiplier, name the end date.",
      "title": "Usage-rights upsell",
      "when": "The contract asks for paid-ad usage priced inside the post fee."
    },
    {
      "body": "On exclusivity, {{brand}}, a broad category lock for {{exclusivity_term}} would freeze out other sponsor revenue for me, so I can't sign it as written. I can do named competitors for 30 days at +25% (${{exclusivity_fee}}) or 60–90 days at +50%, with the competitor list written into the contract. If you need the full category for 6+ months, the premium has to actually cover the deals I'd lose.",
      "grounded_in": "Rate card levers: 30-day exclusivity +25%, 60–90 days +50%; broad 6+ month category locks need a premium that covers lost deals.",
      "id": "exclusivity_pushback",
      "tip": "Narrow exclusivity to named competitors, put a number on it, or don't sign it.",
      "title": "Exclusivity pushback",
      "when": "The deal wants broad or long exclusivity without paying for it."
    },
    {
      "body": "I can hit a {{turnaround}} turnaround, {{brand}}, but it means dropping scheduled work and reordering my content calendar, so rush delivery carries a {{rush_percent}}% rush fee on the post fee. If the timeline can move to {{standard_turnaround}}, the standard rate applies. Your call either way.",
      "grounded_in": "No research benchmark exists for rush fees, this script carries a fill-in rate instead of a fake number.",
      "id": "rush_fee_ask",
      "tip": "Rush means dropping paid work and reordering your content calendar. Set the premium; don't apologize for it.",
      "title": "Rush-fee ask",
      "when": "The brand wants a 48–72 hour turnaround on your normal timeline."
    }
  ],
  "red_flags": [
    {
      "detail": "Unlimited, forever paid-ad rights bundled into the post fee. This turns your post into the brand's permanent ad creative for the price of one post.",
      "fix": "Price perpetual usage as its own line item, or refuse outright. Never fold it into the post fee.",
      "id": "perpetual_usage_organic_price",
      "severity": "walk_away",
      "title": "Perpetual usage for organic price"
    },
    {
      "detail": "Net-90 means you are financing the brand's marketing for a quarter. Without escrow, you have no leverage if they ghost.",
      "fix": "Counter net-30 and 50% upfront, mandatory for any brand you haven't worked with.",
      "id": "net90_no_escrow",
      "severity": "walk_away",
      "title": "Net-90+ payment with no escrow"
    },
    {
      "detail": "An open revision clause is a blank check on your time. 'Just one more tweak' becomes a second production cycle you don't get paid for.",
      "fix": "Cap revisions in writing: two rounds included, paid rate per additional round.",
      "id": "unlimited_revisions",
      "severity": "walk_away",
      "title": "Unlimited revisions"
    },
    {
      "detail": "If they can cancel after you've filmed and owe you nothing, all the production risk sits on you.",
      "fix": "Kill fee in writing: a fixed percentage of the fee if they cancel after filming starts.",
      "id": "no_kill_fee",
      "severity": "walk_away",
      "title": "No kill fee after filming"
    },
    {
      "detail": "Indefinite ad spend off your account and face. Whitelisting is always a premium, always monthly, always revocable.",
      "fix": "Price it monthly, separately from the post fee. Set a hard end date and keep kill-switch access.",
      "id": "perpetual_whitelisting",
      "severity": "major",
      "title": "Perpetual whitelisting"
    },
    {
      "detail": "A category lock kills other sponsor revenue for half a year. One clause can cost you more than the deal pays.",
      "fix": "Narrow to named competitors, or demand a premium that actually covers the lost deals.",
      "id": "broad_exclusivity",
      "severity": "major",
      "title": "Broad / category exclusivity, 6+ months"
    }
  ],
  "scoring": {
    "note": "The checklist scores the deal's contract structure, not its pay, which the Deal Tracker benchmarks separately against the rate card.",
    "rules": [
      "Any 'walk_away' flag checked → verdict: walk away. The structure is hostile no matter the price.",
      "Otherwise score = 2 points per 'major' flag, 1 per 'minor'.",
      "Score 0 → clean: proceed, price the post. Score 1–2 → caution: fix the flagged terms before signing. Score 3+ → walk away."
    ]
  },
  "source": "Wave 15, The Deal Room. Usage-rights multipliers come from the wave-2 2026 sponsorship research pass (usage rights +50–100% band) and the 2026 rate card chapter; scripts are grounded in the rate-card negotiation rules. Wave 22 added 3 pitch email templates (from the sponsorship-pitch skill's outreach procedure) and 10 contract red-flag items (from the Deal Room negotiation content and the deal-negotiation skill) plus contract scoring rules.",
  "updated": "2026-10-12",
  "usage_rights_tiers": [
    {
      "basis": "Definitional: the base post fee covers organic placement only. Not a market rate, it's the absence of a line item.",
      "description": "Content lives on your channel. No paid amplification, no re-runs as ads.",
      "id": "organic",
      "label": "Organic only",
      "multiplier": [
        1.0,
        1.0
      ],
      "multiplier_label": "1.0×, no add-on",
      "reported": false
    },
    {
      "basis": "Reported +50%, takes the bottom of the wave-2 2026 research band for paid-ad usage (+50–100% on top of the post fee).",
      "description": "Brand re-runs your content as paid ads for one month.",
      "id": "paid_30",
      "label": "Paid ads, 30 days",
      "multiplier": [
        1.5,
        1.5
      ],
      "multiplier_label": "1.5× (reported +50%)",
      "reported": true
    },
    {
      "basis": "Reported +75%, the midpoint of the wave-2 2026 research band for paid-ad usage (+50–100%).",
      "description": "Brand re-runs your content as paid ads for half a year.",
      "id": "paid_180",
      "label": "Paid ads, 6 months",
      "multiplier": [
        1.75,
        1.75
      ],
      "multiplier_label": "1.75× (reported +75%)",
      "reported": true
    },
    {
      "basis": "Reported +100%, the top of the wave-2 2026 research band for paid-ad usage (+50–100%). Cap the end date in writing.",
      "description": "Brand re-runs your content as paid ads for a full year.",
      "id": "paid_365",
      "label": "Paid ads, 12 months",
      "multiplier": [
        2.0,
        2.0
      ],
      "multiplier_label": "2.0× (reported +100%)",
      "reported": true
    },
    {
      "basis": "Creator surveys report whitelisting as a premium on top of paid-ad usage, but no research-backed multiplier exists. Quote your own monthly rate, keep it a separate line item, and keep kill-switch access.",
      "description": "Brand runs paid ads through your handle. Always monthly, always revocable.",
      "id": "whitelisting",
      "label": "Whitelisting, ads run from YOUR account",
      "multiplier": null,
      "multiplier_label": "No benchmark, price monthly yourself",
      "reported": false
    },
    {
      "basis": "No safe multiplier exists for a perpetual buyout. Price it as its own line item, never fold it into the post fee, or refuse outright. 2.0× is shown as a negotiation floor, never a rate.",
      "description": "Brand owns the content outright in perpetuity.",
      "id": "buyout",
      "label": "Full buyout, all rights, all media, forever",
      "multiplier": [
        2.0,
        null
      ],
      "multiplier_label": "2.0× floor, no ceiling, or refuse",
      "reported": false
    }
  ],
  "version": "1.2.0",
  "pitch_templates": [
    {
      "id": "cold_pitch",
      "title": "Cold pitch (first outreach)",
      "when": "First email to a brand that has never heard of you. One targeted email per brand, never bulk blasts.",
      "subject": "[Channel Name] x [Brand], a 60-second integration idea",